<?xml version="1.0" encoding="UTF-8"?>
<ns1:mailSending
  xmlns:ns1="http://schema.samply.de/config/MailSending"
  xmlns:xsi='http://www.w3.org/2001/XMLSchema-instance'
  xsi:schemaLocation="http://schema.samply.de/config/MailSending http://schema.samply.de/config/MailSending.xsd">
  <ns1:fromAddress>noreply@samply.de</ns1:fromAddress>
  <ns1:fromName>Samply Mail</ns1:fromName>
  <ns1:host>mail.imbei.uni-mainz.de</ns1:host>
  <ns1:password></ns1:password>
  <ns1:port>25</ns1:port>
  <ns1:protocol>smtp</ns1:protocol>
  <ns1:templateFolder>./src/test/resources/exampleTemplates/</ns1:templateFolder>
  <ns1:user></ns1:user>
</ns1:mailSending>
